{
  "$schema": "https://json-schema.org/draft/2020-12/schema",
  "$id": "https://lightpath.nasa.spaceapps/schemas/provenance.schema.json",
  "title": "Provenance",
  "description": "Full audit trail and reproducibility record for LightPath outputs",
  "type": "object",
  "required": [
    "datasets",
    "kernels",
    "parameters",
    "tolerances",
    "tests_summary"
  ],
  "properties": {
    "datasets": {
      "type": "array",
      "items": {
        "type": "object",
        "required": ["name", "version", "source_url"],
        "properties": {
          "name": { "type": "string" },
          "version": { "type": "string" },
          "source_url": { "type": "string" }
        },
        "additionalProperties": true
      }
    },
    "kernels": {
      "type": "array",
      "items": {
        "type": "object",
        "required": ["name", "checksum"],
        "properties": {
          "name": { "type": "string" },
          "checksum": { "type": "string" }
        },
        "additionalProperties": true
      }
    },
    "parameters": {
      "type": "object",
      "additionalProperties": true
    },
    "tolerances": {
      "type": "object",
      "additionalProperties": { "type": "number" }
    },
    "tests_summary": {
      "type": "object",
      "required": ["tests_passed", "tests_total", "last_verified_utc"],
      "properties": {
        "tests_passed": { "type": "integer", "minimum": 0 },
        "tests_total": { "type": "integer", "minimum": 0 },
        "last_verified_utc": { "type": "string" }
      },
      "additionalProperties": true
    }
  },
  "additionalProperties": false
}
