{
  "datasets": [
    {
      "name": "LOLA Polar DEM (LDEM_80S_120M)",
      "version": "v1.2",
      "source_url": "https://pgda.gsfc.nasa.gov/products/54"
    }
  ],
  "kernels": [
    {
      "name": "de421.bsp (JPL Planetary and Lunar Ephemeris)",
      "checksum": "9cb90336e0145a3e658b19ee4775aabe1f6a960290fe7b6eeb32895d0ce363d5"
    }
  ],
  "parameters": {
    "r_moon_m": 1737400.0,
    "coordinate_frame": "MOON_ME",
    "elevation_formula": "exact_spherical_curvature",
    "site_id": "shackleton-connecting-ridge",
    "observer_height_m": 2.0,
    "start_utc": "2026-11-01T00:00:00Z",
    "end_utc": "2026-11-15T00:00:00Z",
    "step_minutes": 60
  },
  "tolerances": {
    "az_step_deg": 1.0,
    "disc_quadrature_samples": 37.0
  },
  "tests_summary": {
    "tests_passed": 30,
    "tests_total": 30,
    "last_verified_utc": "2026-10-29T10:20:24Z"
  }
}