{
  "datasets": [
    {
      "name": "Synthetic Geometric Surface Generator",
      "version": "pipeline.synthetic-v1.0",
      "source_url": "synthetic://pipeline.synthetic/synthetic-crater-rim"
    }
  ],
  "kernels": [
    {
      "name": "Analytical Lunar Libration & Solar Ephemeris",
      "checksum": "analytical_deterministic_ephemeris"
    }
  ],
  "parameters": {
    "step_minutes": 240,
    "mast_heights_m": [
      0.5,
      1,
      2,
      3,
      5
    ],
    "thresholds": {
      "min_sun_frac": 0.5,
      "min_earth_frac": 0.5,
      "ground_station_mask_deg": 6
    },
    "margins": {
      "horizon_margin_deg": 0.1
    },
    "horizon_params": {
      "az_step_deg": 2,
      "max_range_m": 25000,
      "step_m": 50
    }
  },
  "tolerances": {
    "horizon_dip_deg": 0.005,
    "wall_elevation_deg": 0.01
  },
  "tests_summary": {
    "tests_passed": 89,
    "tests_total": 92,
    "last_verified_utc": "2026-10-29T12:00:00Z"
  }
}