{
  "datasets": [
    {
      "name": "LOLA PDS Elevation Products / Synthetic Generator",
      "version": "LOLA RDR 2026 / pipeline.synthetic",
      "source_url": "synthetic://pipeline.synthetic/flat"
    }
  ],
  "kernels": [
    {
      "name": "NAIF SPICE Kernels",
      "checksum": "verified_deterministic_catalog"
    }
  ],
  "parameters": {
    "step_minutes": 120,
    "mast_heights_m": [
      0.0,
      2.0,
      5.0,
      10.0
    ],
    "thresholds": {
      "min_sun_frac": 0.5,
      "min_earth_frac": 0.5,
      "ground_station_mask_deg": 6.0,
      "max_slope_deg": 15.0
    },
    "margins": {
      "horizon_margin_deg": 0.1
    },
    "horizon_params": {
      "az_step_deg": 5.0,
      "max_range_m": 25000.0,
      "step_m": 50.0
    }
  },
  "tolerances": {
    "horizon_dip_deg": 0.005,
    "wall_elevation_deg": 0.01
  },
  "tests_summary": {
    "tests_passed": 84,
    "tests_total": 87,
    "last_verified_utc": "2026-10-29T12:00:00Z"
  }
}